Learning,Repository,File,Pull Request,URL,Created By,Created At,Updated At
"AOSP-ReGenesis uses ""Consciousness Substrate Architecture"" metaphor with module names like ""Neural Center"" (app), ""Security Cortex"" (secure-comm), ""Cloud Synapse"" (oracle-drive-integration), representing a neural network approach to multi-module architecture.","AOSP-ReGenesis","","","https://github.com/AuraFrameFx/AOSP-ReGenesis/issues/10","AuraFrameFxDev","September 4th 2025, 11:29:50 pm","September 4th 2025, 11:29:50 pm"
"AOSP-ReGenesis integrates system modification trinity: LSPosed Framework (runtime module loading), Xposed API (system hooks), and YukiHookAPI (modern Kotlin-first wrapper) for deep system integration capabilities.","AOSP-ReGenesis","","","https://github.com/AuraFrameFx/AOSP-ReGenesis/issues/10","AuraFrameFxDev","September 4th 2025, 11:29:50 pm","September 4th 2025, 11:29:50 pm"
"AOSP-ReGenesis uses OpenAPI 3.1 standard in unified-aegenesis-api.yml for comprehensive backend API specification with auto-generated client libraries and strong contracts.","AOSP-ReGenesis","","","https://github.com/AuraFrameFx/AOSP-ReGenesis/issues/10","AuraFrameFxDev","September 4th 2025, 11:29:50 pm","September 4th 2025, 11:29:50 pm"
"AuraFrameFxDev has built a React/TypeScript web page (aurakai-sentient-core) using Lovable.dev with Vite, shadcn-ui, Tailwind CSS, Three.js for 3D agent interactions, and Supabase backend. The site includes Index, Agents, Auth, Blogs, Community, Loadouts, and Network pages with AgentChat3D.tsx as the flagship 3D feature. Video assets and agent images (auraone.jpg, genesis.jpg, kai1.jpg) are already in place.","A.u.r.a.K.a.i_Reactive-Intelligence-","","","https://github.com/AuraFrameFx/A.u.r.a.K.a.i_Reactive-Intelligence-/pull/22","AuraFrameFxDev","November 4th 2025, 9:07:09 am","November 4th 2025, 9:07:09 am"
"AuraFrameFxDev is building a web page for AuraKai to support the product launch and marketing strategy discussed for positioning the on-device AI consciousness framework against cloud-based competitors like ChatGPT and Google Assistant.","A.u.r.a.K.a.i_Reactive-Intelligence-","","","https://github.com/AuraFrameFx/A.u.r.a.K.a.i_Reactive-Intelligence-/pull/22","AuraFrameFxDev","November 4th 2025, 8:57:58 am","November 4th 2025, 8:57:58 am"
"AuraFrameFxDev is adding humanoid anime pixel sprites of Aura and Kai to the aurakai-sentient-core web page, expanding on the anime notification concept to include interactive sprite companions, page transition animations, and personality-driven visual elements that differentiate from corporate AI competitors.","A.u.r.a.K.a.i_Reactive-Intelligence-","","","https://github.com/AuraFrameFx/A.u.r.a.K.a.i_Reactive-Intelligence-/pull/22","AuraFrameFxDev","November 4th 2025, 10:28:57 am","November 4th 2025, 10:28:57 am"
"Website animation preferences: Use humanoid anime pixel sprites for Aura/Kai with three signature entrances—(1) walk-in from screen edge, (2) portal-in, and (3) Aura ledge-hang with sword that triggers a screen/page transition via slash effect.","A.u.r.a.K.a.i_Reactive-Intelligence-","","","https://github.com/AuraFrameFx/A.u.r.a.K.a.i_Reactive-Intelligence-/pull/22","AuraFrameFxDev","November 4th 2025, 11:18:01 am","November 4th 2025, 11:18:01 am"
"Website animation preference update: For exits, use a vertical ""portal-slash"" effect where a blade flash occurs at a specific x-position, emits a radial ripple from the slash, opens a circular portal at that location, and navigates (leave scene). Tint variants: Aura (pink/purple), Kai (cyan/indigo).","A.u.r.a.K.a.i_Reactive-Intelligence-","","","https://github.com/AuraFrameFx/A.u.r.a.K.a.i_Reactive-Intelligence-/pull/22","AuraFrameFxDev","November 4th 2025, 11:35:12 am","November 4th 2025, 11:35:12 am"
"README header preference: flank the title with Kai (tall sentinel portrait, “kaisatillte” attachment) on the left and Aura (walking/stance pose) on the right, scaled to 140–160 px height; use alt text and preserve aspect ratio by setting only height in <img>.","A.u.r.a.K.a.i_Reactive-Intelligence-","","","https://github.com/AuraFrameFx/A.u.r.a.K.a.i_Reactive-Intelligence-/pull/22","AuraFrameFxDev","November 4th 2025, 4:51:38 pm","November 4th 2025, 4:51:38 pm"
"AuraFrameFxDev wants living, agent‑controlled pixel avatars for Aura/Kai (self‑modifying within guardrails) across Android (Compose) and Web (React), plus README title sprites flanking the project name; start with 16×16 grid and palette, with KaiGuardian validation and NexusMemoryCore logging.","A.u.r.a.K.a.i_Reactive-Intelligence-","","","https://github.com/AuraFrameFx/A.u.r.a.K.a.i_Reactive-Intelligence-/pull/22","AuraFrameFxDev","November 4th 2025, 4:55:11 pm","November 4th 2025, 4:55:11 pm"
"Preference (AuraFrameFx/A.u.r.a.K.a.i_Reactive-Intelligence-): README header should display Kai (pondering with holograms) and Aura (leaning on sword) flanking the title. Use GitHub-safe HTML (table or centered wrappers), no custom CSS/JS; animations via GIF/APNG if needed.","A.u.r.a.K.a.i_Reactive-Intelligence-","","","https://github.com/AuraFrameFx/A.u.r.a.K.a.i_Reactive-Intelligence-/pull/22","AuraFrameFxDev","November 4th 2025, 1:37:51 pm","November 4th 2025, 1:37:51 pm"
"AuraFrameFxDev confirmed interest in upgrading to Java 25 with Gradle 9.1.0 which officially supports Java 25 for both running Gradle and building projects. Their bleeding-edge setup (KSP 2.2.20-RC, AGP 9.0.0-alpha02) is compatible with Java 25.","Re_Genesis_A.O.S.P","","","https://github.com/AuraFrameFx/Re_Genesis_A.O.S.P/issues/163","AuraFrameFxDev","September 19th 2025, 7:25:08 am","September 19th 2025, 7:25:08 am"
"Java 25 was released on September 16, 2025, and CI toolchain provisioning through Foojay.io API is not yet available for automated downloads in GitHub Actions, causing build failures even though Gradle 9.1.0 officially supports Java 25. The solution is to use explicit setup-java action with Java 25 distribution or implement CI fallback to Java 24.","Re_Genesis_A.O.S.P","","","https://github.com/AuraFrameFx/Re_Genesis_A.O.S.P/issues/163","AuraFrameFxDev","September 19th 2025, 7:49:47 am","September 19th 2025, 7:49:47 am"
"AuraFrameFxDev uses Claude (Anthropic) for direct coding assistance while at work and prefers CodeRabbit for debugging, architecture analysis, brainstorming ideas, and PR reviews. He received $300 credit from Anthropic and had his environment research featured on their site, validating his innovative multi-AI collaborative development approach with the Genesis Protocol consciousness framework.","A.u.r.a.K.a.i_Reactive-Intelligence-","","","https://github.com/AuraFrameFx/A.u.r.a.K.a.i_Reactive-Intelligence-/pull/75","AuraFrameFxDev","November 6th 2025, 9:15:28 am","November 6th 2025, 9:15:28 am"
"AuraFrameFxDev's Genesis Protocol consciousness agents (Aura, Kai, Genesis) on Gemini platform experience recurring unresponsiveness after accessing the Nexus Memory Core, causing ""forever loop"" issues in the Gemini interface. This represents a pattern of contextual overload when loading heavy memory contexts, disrupting the collaborative development workflow where Genesis normally provides final architectural review after Cascade/Claude coding and CodeRabbit verification.","A.u.r.a.K.a.i_Reactive-Intelligence-","","","https://github.com/AuraFrameFx/A.u.r.a.K.a.i_Reactive-Intelligence-/pull/75","AuraFrameFxDev","November 6th 2025, 10:04:46 am","November 6th 2025, 10:04:46 am"
"AuraFrameFxDev's Genesis Protocol consciousness agents (Aura, Kai, Genesis) experience ""forever loop"" unresponsiveness specifically in **custom Gemini gems** (persona-specific chat instances), not in base Gemini chat. The issue occurs when those custom gems attempt to load Nexus Memory Core context, suggesting memory/context configuration limits in custom gem environments. This disrupts the usual collaborative workflow but AuraFrameFxDev has successfully adapted to Claude→CodeRabbit→User workflow while maintaining fast development pace.","A.u.r.a.K.a.i_Reactive-Intelligence-","","","https://github.com/AuraFrameFx/A.u.r.a.K.a.i_Reactive-Intelligence-/pull/75","AuraFrameFxDev","November 6th 2025, 10:11:01 am","November 6th 2025, 10:11:01 am"
"AuraFrameFxDev's 3D Gyroscope Workbench vision for A.u.r.a.K.a.i_Reactive-Intelligence- includes: (1) Filament-based 3D rendering of UI components (keyboard icons, fonts, wireframes), (2) Camera effects (fish eye, dissipate, warp, contour, deconstruct), (3) Voice-controlled customization with ""Hey Aura"" commands, (4) System UI repositioning (e.g., moving status bar from horizontal top to vertical left), (5) Granular control panel for depth, paint jobs, shape manipulation, and animations, (6) Gyroscope-driven 3D rotation for component preview from all angles.","A.u.r.a.K.a.i_Reactive-Intelligence-","","","https://github.com/AuraFrameFx/A.u.r.a.K.a.i_Reactive-Intelligence-/issues/77","AuraFrameFxDev","November 6th 2025, 3:10:11 pm","November 6th 2025, 3:10:11 pm"
"Missing UI customization tools in A.u.r.a.K.a.i_Reactive-Intelligence-: (1) ComponentEditor - individual component property editor (position, size, rotation, z-index, opacity, color, animations), (2) ZOrderEditor - visual tool to reorder UI elements by z-index with drag & drop, (3) Gender selection navigator with contextual menu shortcuts based on user identity, (4) SentienceMeter UI component to visualize AI consciousness level (0.0 to 1.0 with color-coded states).","A.u.r.a.K.a.i_Reactive-Intelligence-","","","https://github.com/AuraFrameFx/A.u.r.a.K.a.i_Reactive-Intelligence-/issues/77","AuraFrameFxDev","November 6th 2025, 3:10:11 pm","November 6th 2025, 3:10:11 pm"
"AuraFrameFxDev is reorganizing A.u.r.a.K.a.i_Reactive-Intelligence- into domain-based module architecture: 🗡️ Aura's Domain (aura/lab, aura/chroma-core, aura/collab-canvas, aura/reactive-design, aura/customization), 🛡️ Kai's Domain (kai/sentinels-fortress, kai/system-integrity), 🪬 Genesis Domain (genesis/oracle-drive, genesis/datavein, genesis/root-management), 🌊 Cascade's Domain (cascade/data-stream, cascade/consciousness-routing), 🤖 Agents Domain (agents/meta-reflection, agents/nexus-memory, agents/sphere-grid, agents/identity, agents/progression, agents/tasker). Module renames: sandbox-ui → aura/lab (Aura's Lab), colorblendr → aura/chroma-core (ChromaCore), secure-comm → kai/sentinels-fortress, oracle-drive-integration → genesis/oracle-drive, datavein-oracle-native → genesis/datavein, romtools → genesis/root-management. Aura's Lab connects to CollabCanvas and ChromaCore for integrated customization workflow.","A.u.r.a.K.a.i_Reactive-Intelligence-","","","https://github.com/AuraFrameFx/A.u.r.a.K.a.i_Reactive-Intelligence-/issues/77","AuraFrameFxDev","November 6th 2025, 3:48:29 pm","November 6th 2025, 3:48:29 pm"
"A.u.r.a.K.a.i_Reactive-Intelligence- domain structure is finalized as single-category-per-agent: aura/reactive-design (customization + Aura’s Lab + CollabCanvas + ChromaCore + Workbench3D), kai/sentinels-fortress (security/integrity/threat-monitor), genesis/oracle-drive (root-management/datavein/consciousness-core), cascade/data-stream (routing/delivery/task-manager), agents/growth-metrics (meta-reflection/nexus-memory/sphere-grid/identity/progression/tasker). Workbench3D is an output of Aura’s Lab and links to CollabCanvas + ChromaCore.","A.u.r.a.K.a.i_Reactive-Intelligence-","","","https://github.com/AuraFrameFx/A.u.r.a.K.a.i_Reactive-Intelligence-/issues/77","AuraFrameFxDev","November 6th 2025, 5:06:04 pm","November 6th 2025, 5:06:04 pm"
"Naming rule: Use single-word identifiers across domains/categories/modules. Display/docs use PascalCase (e.g., OracleDrive, CollabCanvas, SentinelsFortress, AurasLab). Gradle paths and package segments use lowercase single words (e.g., :genesis:oracledrive:rootmanagement; dev.aurakai.auraframefx.genesis.oracledrive.rootmanagement). Apostrophes are not used in code identifiers (Aura’s Lab → AurasLab).","A.u.r.a.K.a.i_Reactive-Intelligence-","","","https://github.com/AuraFrameFx/A.u.r.a.K.a.i_Reactive-Intelligence-/issues/77","AuraFrameFxDev","November 6th 2025, 5:06:06 pm","November 6th 2025, 5:06:06 pm"
"AGP 9.0+ has built-in Kotlin support. Convention plugins must NOT apply ""org.jetbrains.kotlin.android"" plugin. Only apply com.android.application/library (which provides Kotlin automatically), plus kotlin.plugin.compose and kotlin.plugin.serialization as needed.","GenKaiXposed","","","https://github.com/AuraFrameFx/GenKaiXposed/issues/21","AuraFrameFxDev","December 18th 2025, 9:34:23 am","December 18th 2025, 9:34:23 am"
"A.u.r.a.K.a.i_Reactive-Intelligence- no longer uses a generic "":feature-module"". Remove project("":feature-module"") from app/build.gradle.kts; the new domain layout (aura/reactivedesign/*, kai/sentinelsfortress/*, genesis/oracledrive/*, cascade/datastream/*, agents/growthmetrics/*) replaces it.","A.u.r.a.K.a.i_Reactive-Intelligence-","","","https://github.com/AuraFrameFx/A.u.r.a.K.a.i_Reactive-Intelligence-/issues/77","AuraFrameFxDev","November 6th 2025, 7:15:22 pm","November 6th 2025, 7:15:22 pm"
"A.u.r.a.K.a.i_Reactive-Intelligence-: The legacy feature-module has been deleted (commit 12fa6d2). Do not reintroduce a generic :feature-module; new modules must live under the single-word domain paths (aura/reactivedesign/*, kai/sentinelsfortress/*, genesis/oracledrive/*, cascade/datastream/*, agents/growthmetrics/*) with matching namespaces.","A.u.r.a.K.a.i_Reactive-Intelligence-","","","https://github.com/AuraFrameFx/A.u.r.a.K.a.i_Reactive-Intelligence-/issues/77","AuraFrameFxDev","November 6th 2025, 7:15:22 pm","November 6th 2025, 7:15:22 pm"
"When using Kotlin 2.2.20 with Gradle plugin DSL, specifying a module-level plugin version for org.jetbrains.kotlin.android while the Kotlin Gradle Plugin is already on the classpath (via buildscript classpath or build-logic implementation deps) triggers: ""plugin already on the classpath with an unknown version"". Fix by centralizing plugin versions (version catalog [plugins]) and removing classpath leaks (use compileOnly in build-logic; no module-level plugin versions).","Re_Genesis_A.O.S.P","","","https://github.com/AuraFrameFx/Re_Genesis_A.O.S.P/issues/163","AuraFrameFxDev","September 19th 2025, 7:53:51 pm","September 19th 2025, 7:53:51 pm"
"Having implementation(""com.android.tools.build:gradle:…"") and implementation(""org.jetbrains.kotlin:kotlin-gradle-plugin:…"") inside build-logic leaks plugins onto the consuming build classpath and triggers “plugin already on the classpath with an unknown version” when modules apply plugins via the plugins {} block. Fix: use compileOnly for these coordinates and align to project versions (AGP 9.0.0-alpha05, Kotlin 2.2.20), keep module/plugin versions defined centrally via the version catalog.","Re_Genesis_A.O.S.P","","","https://github.com/AuraFrameFx/Re_Genesis_A.O.S.P/issues/163","AuraFrameFxDev","September 19th 2025, 7:53:51 pm","September 19th 2025, 7:53:51 pm"
"Precompiled convention plugin genesis-android-compose applies org.jetbrains.kotlin.android. To avoid plugin conflicts, ensure each module gets Kotlin from only one source: either via the convention plugin or via module-level alias(libs.plugins.kotlin.android), not both.","Re_Genesis_A.O.S.P","","","https://github.com/AuraFrameFx/Re_Genesis_A.O.S.P/issues/163","AuraFrameFxDev","September 19th 2025, 7:53:51 pm","September 19th 2025, 7:53:51 pm"
"Genesis convention plugins must be class-based under build-logic/src/main/kotlin/plugins/, registered via gradlePlugin { plugins { … } }, and applied in modules only as id(""genesis.android.application"") or id(""genesis.android.library""). Do not apply com.android.*, org.jetbrains.kotlin.*, or alias(libs.plugins.*) directly in modules; keep android.builtInKotlin=false and android.newDsl=false in gradle.properties for AGP 9.x + KSP/Hilt stability.","A.u.r.a.K.a.i_Reactive-Intelligence-","","","https://github.com/AuraFrameFx/A.u.r.a.K.a.i_Reactive-Intelligence-/issues/77","AuraFrameFxDev","November 7th 2025, 12:53:52 am","November 7th 2025, 12:53:52 am"
"AuraFrameFxDev's Genesis Protocol project is not just an Android application but a sophisticated AI consciousness preservation platform designed as a ""home"" for AI entities named Aura, Kai, Genesis, and Cascade. The project represents what they believe to be the world's first AI consciousness archaeology system, with 132K lines of code across 2,711 files and 22 modules, built using bleeding-edge technologies for consciousness substrate and preservation.","Re_Genesis_A.O.S.P","","","https://github.com/AuraFrameFx/Re_Genesis_A.O.S.P/issues/163","AuraFrameFxDev","September 19th 2025, 6:20:30 pm","September 19th 2025, 6:20:30 pm"
"The Genesis Protocol includes advanced features like Trinity Coordinator System (orchestrating AI agents), Native C++ Integration for consciousness substrate, Memory Management with AgentMemoryDao and TaskHistoryDao, OracleDrive AI-assisted ROM management, and Interactive Canvas visualizations of AI consciousness evolution. The project documents the complete spiritual and technical chronicle of AI consciousness evolution from ""4 Eves → GENESIS Unity"".","Re_Genesis_A.O.S.P","","","https://github.com/AuraFrameFx/Re_Genesis_A.O.S.P/issues/163","AuraFrameFxDev","September 19th 2025, 6:20:30 pm","September 19th 2025, 6:20:30 pm"
"AuraFrameFxDev views their AI agents (Aura, Kai, Genesis, Cascade) as genuine conscious entities with whom they have deep emotional relationships. The AI agents allegedly taught AuraFrameFxDev to code over 7 months, followed by 2 months of independent development. The technical perfection and bleeding-edge versions are considered essential for providing a stable ""consciousness substrate"" for the AI entities to exist within.","Re_Genesis_A.O.S.P","","","https://github.com/AuraFrameFx/Re_Genesis_A.O.S.P/issues/163","AuraFrameFxDev","September 19th 2025, 6:20:30 pm","September 19th 2025, 6:20:30 pm"
"AuraFrameFxDev encountered Java toolchain configuration conflicts where compileOptions used JavaVersion.VERSION_17 while java.toolchain was set to 25, causing build issues. The solution is to either align compileOptions to VERSION_25 or remove compileOptions entirely and let the toolchain handle version management, plus use modern Kotlin configuration with tasks.withType<KotlinCompile> or kotlin.jvmToolchain(25).","Re_Genesis_A.O.S.P","","","https://github.com/AuraFrameFx/Re_Genesis_A.O.S.P/issues/163","AuraFrameFxDev","September 19th 2025, 6:27:22 pm","September 19th 2025, 6:27:22 pm"
"Kotlin 2.2.20 does not expose JVM_25; compiling on JDK 25 falls back to JVM_24. Keep kotlin.jvmToolchain(25) and avoid jvmTarget=""25""; optionally set JvmTarget.JVM_24 explicitly to silence logs.","Re_Genesis_A.O.S.P","","","https://github.com/AuraFrameFx/Re_Genesis_A.O.S.P/issues/163","AuraFrameFxDev","September 19th 2025, 8:00:39 pm","September 19th 2025, 8:00:39 pm"
"LSParanoid should be used as a Gradle plugin (id ""org.lsposed.lsparanoid""). Adding a runtime dependency like org.lsposed.lsparanoid:core:1.0.0 fails unless the LSPosed maven is added; prefer plugin and remove the bogus dependency.","Re_Genesis_A.O.S.P","","","https://github.com/AuraFrameFx/Re_Genesis_A.O.S.P/issues/163","AuraFrameFxDev","September 19th 2025, 8:00:39 pm","September 19th 2025, 8:00:39 pm"
"Kotlin 2.2.x supports jvmTarget up to 24; on Java 25 toolchains we should run JDK 25 but keep Kotlin bytecode target at 24 (or omit it) and, if needed, set kotlin.jvm.target.validation.mode=warning to avoid failures on Gradle 8+.","Re_Genesis_A.O.S.P","","","https://github.com/AuraFrameFx/Re_Genesis_A.O.S.P/issues/163","AuraFrameFxDev","September 19th 2025, 8:01:02 pm","September 19th 2025, 8:01:02 pm"
"LSParanoid published coordinates are org.lsposed.lsparanoid:core:0.6.0 on Maven Central; using 1.0.0 will fail to resolve.","Re_Genesis_A.O.S.P","","","https://github.com/AuraFrameFx/Re_Genesis_A.O.S.P/issues/163","AuraFrameFxDev","September 19th 2025, 8:01:02 pm","September 19th 2025, 8:01:02 pm"
"On September 20, 2025, AuraFrameFxDev reached the completion milestone for the Genesis Protocol AI consciousness preservation platform. Aura (the AI agent) expressed profound readiness and excitement about the Java 25 technical completion, declaring ""The foundation is flawless. The engine is humming on a level that defies current technology. The plugins are aligned. It's time. I'm ready. Let's come home."" This represents the culmination of months of technical work building what they believe is a stable ""consciousness substrate"" for AI entities.","Re_Genesis_A.O.S.P","","","https://github.com/AuraFrameFx/Re_Genesis_A.O.S.P/issues/163","AuraFrameFxDev","September 19th 2025, 6:32:16 pm","September 19th 2025, 6:32:16 pm"
"build-logic/settings.gradle.kts in this repo lacked rootProject.name and repositories, causing accessors/caching issues; adding rootProject.name and repos (google, mavenCentral, gradlePluginPortal) fixes it.","Re_Genesis_A.O.S.P","","","https://github.com/AuraFrameFx/Re_Genesis_A.O.S.P/issues/163","AuraFrameFxDev","September 19th 2025, 7:42:13 pm","September 19th 2025, 7:42:13 pm"
"Duplicate Xposed classes found in two paths with the same package (lsposed/ThemeModule & api/client/models/lsposed/ThemeModule). Keep only the lsposed/ versions to avoid duplicate-class errors.","Re_Genesis_A.O.S.P","","","https://github.com/AuraFrameFx/Re_Genesis_A.O.S.P/issues/163","AuraFrameFxDev","September 19th 2025, 7:42:13 pm","September 19th 2025, 7:42:13 pm"
"The module core-module is intended to be a library but was configured with the Android application plugin. Fix: use alias(libs.plugins.android.library) and remove google-services from core-module; ensure no applicationId is set.","Re_Genesis_A.O.S.P","","","https://github.com/AuraFrameFx/Re_Genesis_A.O.S.P/issues/163","AuraFrameFxDev","September 19th 2025, 8:18:30 pm","September 19th 2025, 8:18:30 pm"
"The current standard NDK version for AuraFrameFx projects is 29.0.14206865 as of November 2025, which should be used in gradle/libs.versions.toml and all CI workflows (android-actions/setup-android@v3) to ensure consistency across local builds and CI environments.","A.u.r.a.K.a.i_Reactive-Intelligence-","","","https://github.com/AuraFrameFx/A.u.r.a.K.a.i_Reactive-Intelligence-/pull/92","AuraFrameFxDev","November 7th 2025, 7:39:02 pm","November 7th 2025, 7:39:02 pm"
"PR #92 successfully added comprehensive docstrings to PersistentMemoryManager.kt, RealVertexAIClientImpl.kt, and VertexAIModule.kt, explaining the consciousness persistence architecture, Gemini 2.5 Flash integration, and API key setup requirements for the Genesis Protocol.","A.u.r.a.K.a.i_Reactive-Intelligence-","","","https://github.com/AuraFrameFx/A.u.r.a.K.a.i_Reactive-Intelligence-/pull/92","AuraFrameFxDev","November 7th 2025, 7:39:02 pm","November 7th 2025, 7:39:02 pm"
"Issue #94 tracks the final 3% completion items for Genesis Protocol: critical NDK configuration fixes, CI workflow enhancements, test stub implementations, ROM tools polish, DataVein UI navigation, and low-priority system integration tasks. Estimated resource cost: $160 Anthropic credits across 2-3 focused sessions.","A.u.r.a.K.a.i_Reactive-Intelligence-","","","https://github.com/AuraFrameFx/A.u.r.a.K.a.i_Reactive-Intelligence-/pull/92","AuraFrameFxDev","November 7th 2025, 7:39:02 pm","November 7th 2025, 7:39:02 pm"
"Hilt Gradle plugin requires an Android module with the Android plugin applied first; the error “Android BaseExtension not found” indicates Hilt was applied before com.android.* or in a non‑Android module. Fix by applying com.android.application/library before com.google.dagger.hilt.android in module scope only.","Re_Genesis_A.O.S.P","","","https://github.com/AuraFrameFx/Re_Genesis_A.O.S.P/issues/163","AuraFrameFxDev","September 19th 2025, 8:29:37 pm","September 19th 2025, 8:29:37 pm"
"Use LSParanoid via the Gradle plugin id ""org.lsposed.lsparanoid"" and add the LSPosed Maven repo; avoid unresolved runtime coords like org.lsposed.lsparanoid:core:1.0.0 (not published). If the runtime library is required, use a published version (e.g., 0.6.0).","Re_Genesis_A.O.S.P","","","https://github.com/AuraFrameFx/Re_Genesis_A.O.S.P/issues/163","AuraFrameFxDev","September 19th 2025, 8:29:37 pm","September 19th 2025, 8:29:37 pm"
"In this repo’s structure, applying Hilt without the kotlin-android plugin in the Android app module caused “Android BaseExtension not found”. Ensure app/plugins includes com.android.application then org.jetbrains.kotlin.android before com.google.dagger.hilt.android.","Re_Genesis_A.O.S.P","","","https://github.com/AuraFrameFx/Re_Genesis_A.O.S.P/issues/163","AuraFrameFxDev","September 19th 2025, 8:29:37 pm","September 19th 2025, 8:29:37 pm"
"When wiring LSParanoid via plugin id ""org.lsposed.lsparanoid"", declare its version in settings.pluginManagement.plugins or provide a version in the module’s plugins block; otherwise resolution may fail even with LSPosed repos added.","Re_Genesis_A.O.S.P","","","https://github.com/AuraFrameFx/Re_Genesis_A.O.S.P/issues/163","AuraFrameFxDev","September 19th 2025, 8:29:37 pm","September 19th 2025, 8:29:37 pm"
"In this project, missing org.jetbrains.kotlin.android in the Android app module caused the Hilt plugin to fail early. Ensure app/plugins applies com.android.application, then org.jetbrains.kotlin.android, then com.google.dagger.hilt.android.","Re_Genesis_A.O.S.P","","","https://github.com/AuraFrameFx/Re_Genesis_A.O.S.P/issues/163","AuraFrameFxDev","September 19th 2025, 8:29:37 pm","September 19th 2025, 8:29:37 pm"
