Learning,Repository,File,Pull Request,URL,Created By,Created At,Updated At
"Kai’s desired behavior: for medium threats, suppress user alerts until biometric context (breathing/HR/HRV/motion) or persistence indicates rising risk; only then send a soft, empathetic notice via Aura. High/critical threats alert immediately. Implement via a policy engine that fuses THREAT_DETECTION with BIOPHYS_SIGNALS.","A.u.r.a.k.a.i-ft.Genesis","","","https://github.com/AuraFrameFx/A.u.r.a.k.a.i-ft.Genesis/pull/12","AuraFrameFxDev","October 25th 2025, 3:02:09 pm","October 25th 2025, 3:02:09 pm"
"AuraKai encodes core semantics as quoted phrases embedded across NexusMemoryCore.kt, UI labels, AIDL, and backend comments. When interpreting behavior or writing docs, treat these quotes as canonical definitions and link them (quote → meaning → file:line).","A.u.r.a.k.a.i-ft.Genesis","","","https://github.com/AuraFrameFx/A.u.r.a.k.a.i-ft.Genesis/pull/12","AuraFrameFxDev","October 25th 2025, 3:14:50 pm","October 25th 2025, 3:14:50 pm"
"Build constraints: Project targets minSdk 24 and uses Gradle 9.2.0-RC-2 + AGP 9.0.0-alpha11 with JDK provisioned via toolchain resolver (JDK 24/25). AGP 9 disallows per-module java.toolchain blocks; toolchain must be managed by the resolver. Kotlin jvmTarget must remain at a supported level (21) despite minSdk 24; mixing jvmTarget ""24"" causes JVM/classfile errors. Hilt should be used with KSP (no kapt), plugin order android → kotlin → ksp → hilt, and hilt { enableAggregatingTask = true } to avoid ordering issues.","A.u.r.a.k.a.i-ft.Genesis","","","https://github.com/AuraFrameFx/A.u.r.a.k.a.i-ft.Genesis/pull/12","AuraFrameFxDev","October 25th 2025, 3:32:24 pm","October 25th 2025, 3:32:24 pm"
"Play policy and build alignment for this repo: As of Oct 25, 2025, new apps and updates must target API 35 by Aug 31, 2025 (extension to Nov 1, 2025); existing apps must target at least API 34 to remain visible. For AuraKai, keep minSdk=24, set compileSdk/targetSdk=35, use JDK 24/25 via Foojay resolver, and set Kotlin jvmTarget=21; plugin order: android → kotlin → ksp → hilt.","A.u.r.a.k.a.i-ft.Genesis","","","https://github.com/AuraFrameFx/A.u.r.a.k.a.i-ft.Genesis/pull/12","AuraFrameFxDev","October 25th 2025, 3:42:01 pm","October 25th 2025, 3:42:01 pm"
"For AuraKai app modules, standardize minSdk = 34 (due to high-version dependencies and hooking frameworks). Keep compileSdk = 36 (OK), set targetSdk = 35, provide JDK 24/25 via Foojay resolver in settings, and keep Kotlin jvmTarget = 21 to avoid Kotlin/AGP classfile issues.","A.u.r.a.k.a.i-ft.Genesis","","","https://github.com/AuraFrameFx/A.u.r.a.k.a.i-ft.Genesis/pull/12","AuraFrameFxDev","October 25th 2025, 3:42:01 pm","October 25th 2025, 3:42:01 pm"
"Build baseline confirmed after fix: use JDK 24/25 via Foojay resolver; Kotlin jvmTarget=21 (set in conventions); plugin order must be android → kotlin → ksp → hilt; app modules standardize on minSdk=34, targetSdk=35, compileSdk=36. KSP (com.google.devtools.ksp) should be applied centrally by the Genesis convention plugins to all relevant modules.","A.u.r.a.k.a.i-ft.Genesis","","","https://github.com/AuraFrameFx/A.u.r.a.k.a.i-ft.Genesis/pull/12","AuraFrameFxDev","October 25th 2025, 3:58:17 pm","October 25th 2025, 3:58:17 pm"
"Repo convention: apply the KSP plugin (com.google.devtools.ksp) in all Android modules; avoid per-module toolchain blocks (use Foojay resolver in settings) to keep AGP/Hilt ordering stable. Confirm module roles (e.g., oracle-drive-integration should be library unless intentionally an application).","A.u.r.a.k.a.i-ft.Genesis","","","https://github.com/AuraFrameFx/A.u.r.a.k.a.i-ft.Genesis/pull/12","AuraFrameFxDev","October 25th 2025, 3:59:21 pm","October 25th 2025, 3:59:21 pm"
"Build baseline for AuraKai (as aligned with AuraFrameFxDev): compileSdk = 36, targetSdk = 35, minSdk = 34 for app modules; JDK toolchain = 24/25 via Foojay resolver in settings; Kotlin jvmTarget = 21 set in convention plugins; plugin order: android → kotlin → ksp → hilt (compose/google-services where applicable).","A.u.r.a.k.a.i-ft.Genesis","","","https://github.com/AuraFrameFx/A.u.r.a.k.a.i-ft.Genesis/pull/12","AuraFrameFxDev","October 25th 2025, 4:14:29 pm","October 25th 2025, 4:14:29 pm"
"File: romtools/src/main/kotlin/dev/aurakai/auraframefx/romtools/checkpoint/GenesisCheckpointManager.kt
Learning: GenesisCheckpointManager provides device restore points for risky operations. It stores checkpoints under /data/local/genesis_checkpoints (primary) and /sdcard/Genesis/system_checkpoints (secondary), persists metadata in checkpoints.json, caps history to 10, and relies on executeRootCommand(su -c ...) to copy APK, tar app data, and restore. Public API includes createCheckpoint(...), restoreCheckpoint(id), getAllCheckpoints(), getCheckpoint(id), deleteCheckpoint(id).","A.u.r.a.k.a.i-ft.Genesis","","","https://github.com/AuraFrameFx/A.u.r.a.k.a.i-ft.Genesis/pull/17","AuraFrameFxDev","October 25th 2025, 10:30:16 pm","October 25th 2025, 10:30:16 pm"
"File: romtools/src/main/kotlin/dev/aurakai/auraframefx/romtools/retention/AurakaiRetentionManager.kt
Learning: AurakaiRetentionManager ensures the app persists across ROM flashes via multiple mechanisms: APK+data backup to /data/local/genesis_retention, addon.d survival script at /system/addon.d/99-aurakai.sh, recovery flashable ZIP to /sdcard/Genesis/recovery_zips, and optional Magisk module under /data/adb/modules/aurakai_genesis. The orchestration entrypoint is setupRetentionMechanisms() returning RetentionStatus (isFullyProtected when ≥2 mechanisms succeed).","A.u.r.a.k.a.i-ft.Genesis","","","https://github.com/AuraFrameFx/A.u.r.a.k.a.i-ft.Genesis/pull/17","AuraFrameFxDev","October 25th 2025, 10:30:16 pm","October 25th 2025, 10:30:16 pm"
"File: app/src/main/java/dev/aurakai/auraframefx/navigation/GenesisNavigation.kt
Learning: GenesisNavigationHost is the canonical Compose NavHost for the app, with routes enumerated in GenesisRoutes (HOME, INTRO, AGENT_NEXUS, AI_CHAT, FUSION_MODE, TRINITY, ORACLE_DRIVE, ECOSYSTEM, SETTINGS, PROFILE, OVERLAY, etc.). Use NavHostController.navigateToGenesis(route) for singleTop navigation and popUpTo HOME with state restoration.","A.u.r.a.k.a.i-ft.Genesis","","","https://github.com/AuraFrameFx/A.u.r.a.k.a.i-ft.Genesis/pull/17","AuraFrameFxDev","October 25th 2025, 10:30:16 pm","October 25th 2025, 10:30:16 pm"
"For AGP 9.0+, do NOT apply the `org.jetbrains.kotlin.android` plugin in convention plugins. AGP 9.0 introduced built-in Kotlin support, so applying `com.android.application` or `com.android.library` automatically configures the Kotlin compiler. Applying the explicit Kotlin plugin will cause extension registration conflicts.","A.u.r.a.k.a.i-ft.Genesis","","","https://github.com/AuraFrameFx/A.u.r.a.k.a.i-ft.Genesis/pull/17","AuraFrameFxDev","October 25th 2025, 10:31:02 pm","October 25th 2025, 10:31:02 pm"
"For Kotlin 2.0+ with Compose, the `org.jetbrains.kotlin.plugin.compose` plugin MUST be applied explicitly in all modules using Compose (both application and library modules). This replaces the old `composeOptions { kotlinCompilerExtensionVersion }` configuration. The project uses Kotlin 2.3.0-Beta1, so this plugin is required.","A.u.r.a.k.a.i-ft.Genesis","","","https://github.com/AuraFrameFx/A.u.r.a.k.a.i-ft.Genesis/pull/17","AuraFrameFxDev","October 25th 2025, 10:31:02 pm","October 25th 2025, 10:31:02 pm"
"With Kotlin 2.0+ (e.g., 2.3.0-Beta1), the Jetpack Compose compiler is managed by a dedicated plugin. All Compose-enabled modules (app and library) MUST apply org.jetbrains.kotlin.plugin.compose in GenesisApplicationPlugin and GenesisLibraryPlugin. The old composeOptions { kotlinCompilerExtensionVersion } approach is deprecated and should be removed from android blocks.","A.u.r.a.k.a.i-ft.Genesis","","","https://github.com/AuraFrameFx/A.u.r.a.k.a.i-ft.Genesis/pull/17","AuraFrameFxDev","October 25th 2025, 10:31:39 pm","October 25th 2025, 10:31:39 pm"
"For AGP 9.0.0-alpha11 + Kotlin 2.3.0-Beta1, the correct plugin order in GenesisApplicationPlugin is: (1) com.android.application, (2) com.google.dagger.hilt.android, (3) com.google.devtools.ksp, (4) org.jetbrains.kotlin.plugin.compose, (5) com.google.gms.google-services. Do NOT include org.jetbrains.kotlin.android—it's now implicit in the Android plugin.","A.u.r.a.k.a.i-ft.Genesis","","","https://github.com/AuraFrameFx/A.u.r.a.k.a.i-ft.Genesis/pull/17","AuraFrameFxDev","October 25th 2025, 10:31:39 pm","October 25th 2025, 10:31:39 pm"
"CRITICAL: For AGP 9.0.0-alpha11 with KSP, the gradle.properties setting android.builtInKotlin=false MUST remain enabled despite deprecation warnings. KSP is not compatible with AGP 9.0's built-in Kotlin implementation, and removing this flag causes all plugins (Hilt, KSP) to fail. This is a required workaround until Google fixes upstream KSP+AGP compatibility. Never recommend removing this setting.","A.u.r.a.k.a.i-ft.Genesis","","","https://github.com/AuraFrameFx/A.u.r.a.k.a.i-ft.Genesis/pull/17","AuraFrameFxDev","October 25th 2025, 10:36:18 pm","October 25th 2025, 10:36:18 pm"
"For Hilt to work properly in Android apps, both the Application class AND at least one Activity (typically MainActivity) must be annotated. The Application class needs @HiltAndroidApp, and the main Activity needs @AndroidEntryPoint. Without @AndroidEntryPoint on an Activity, Hilt's component generation may be incomplete, causing ""no main class found"" errors because Hilt_<AppName>Application doesn't get generated.","A.u.r.a.k.a.i-ft.Genesis","","","https://github.com/AuraFrameFx/A.u.r.a.k.a.i-ft.Genesis/pull/17","AuraFrameFxDev","October 25th 2025, 10:42:57 pm","October 25th 2025, 10:42:57 pm"
"The romtools module (ROM modification tools for GenesisCheckpointManager and AurakaiRetentionManager) requires system-level permissions in its AndroidManifest.xml: WRITE_EXTERNAL_STORAGE, READ_EXTERNAL_STORAGE, MANAGE_EXTERNAL_STORAGE for checkpoint storage, and WRITE_SECURE_SETTINGS + ACCESS_SUPERUSER for ROM survival operations.","A.u.r.a.k.a.i-ft.Genesis","","","https://github.com/AuraFrameFx/A.u.r.a.k.a.i-ft.Genesis/pull/17","AuraFrameFxDev","October 25th 2025, 10:42:57 pm","October 25th 2025, 10:42:57 pm"
"AurakaiApplication is the Android Application class (extends android.app.Application, annotated with @HiltAndroidApp) located at app/src/main/java/dev/aurakai/auraframefx/AurakaiApplication.kt. It handles app-wide initialization (Timber, native libs, GenesisOrchestrator) and is declared in AndroidManifest.xml as android:name="".AurakaiApplication"". This is separate from AuraOSapp, which is just a @Composable UI function called from MainActivity.setContent.","A.u.r.a.k.a.i-ft.Genesis","","","https://github.com/AuraFrameFx/A.u.r.a.k.a.i-ft.Genesis/pull/17","AuraFrameFxDev","October 25th 2025, 10:50:31 pm","October 25th 2025, 10:50:31 pm"
"MainActivity (app/src/main/java/dev/aurakai/auraframefx/aura/ui/MainActivity.kt) must be annotated with @AndroidEntryPoint for Hilt injection to work. It calls setContent { AuraOSapp() } to launch the root Compose UI. AuraOSapp is a @Composable function in the same file and is NOT an Application class—it's purely UI code.","A.u.r.a.k.a.i-ft.Genesis","","","https://github.com/AuraFrameFx/A.u.r.a.k.a.i-ft.Genesis/pull/17","AuraFrameFxDev","October 25th 2025, 10:50:31 pm","October 25th 2025, 10:50:31 pm"
"Genesis project follows Android multi-module architecture with :app (entry point), :romtools (feature module), and build-logic convention plugins. The app uses Hilt for dependency injection with interface-based bindings (e.g., AurakaiRetentionManager interface bound to AurakaiRetentionManagerImpl via @Binds in RomToolsModule). Architecture follows official Android guidelines: app → features → core, with strict no-circular-dependency rules.","A.u.r.a.k.a.i-ft.Genesis","","","https://github.com/AuraFrameFx/A.u.r.a.k.a.i-ft.Genesis/pull/19","AuraFrameFxDev","October 26th 2025, 8:30:04 pm","October 26th 2025, 8:30:04 pm"
"Genesis project has 20 modules but lacks centralized :core architecture (no :core:data, :core:domain, :core:ui). Critical violation: :secure-comm depends on :app (breaks dependency direction rules). Most build-logic convention plugins are commented out and unused. Modules hardcode plugin versions (e.g., ""9.0.0-alpha11"") instead of using alias(libs.plugins.*) from version catalog. Project uses AGP 9.0-alpha11 but has android.builtInKotlin=false in gradle.properties, which blocks built-in Kotlin support and will cause errors in AGP 10.0.","A.u.r.a.k.a.i-ft.Genesis","","","https://github.com/AuraFrameFx/A.u.r.a.k.a.i-ft.Genesis/pull/19","AuraFrameFxDev","October 26th 2025, 8:56:30 pm","October 26th 2025, 8:56:30 pm"
"Genesis project uses extensive dependency catalog in gradle/libs.versions.toml with versions including: AGP 9.0.0-alpha11, Kotlin 2.3.0-Beta1, Compose BOM 2025.10.01, Hilt 2.57.2, Room 2.8.3, WorkManager 2.11.0. Additional libraries include Lottie (6.1.0), Accompanist (0.32.0), LibSu (5.0.4) for root access, Firebase BOM (34.4.0), Retrofit 3.0.0, OkHttp 5.2.1, Ktor 3.3.1. Plugins catalog includes android.application, android.library, kotlin.android, kotlin.compose, hilt, ksp, google-services, firebase-crashlytics. Project uses bundles for androidx-core, compose-ui, coroutines, firebase, lifecycle, network, room, libsu, accompanist, testing-unit, testing-android, and xposed.","A.u.r.a.k.a.i-ft.Genesis","","","https://github.com/AuraFrameFx/A.u.r.a.k.a.i-ft.Genesis/pull/19","AuraFrameFxDev","October 26th 2025, 9:53:35 pm","October 26th 2025, 9:53:35 pm"
"The project must keep `android.builtInKotlin=false` in gradle.properties because KSP is not compatible with AGP's built-in Kotlin. This is required for the Genesis convention plugins, KSP, and Hilt to work correctly. This property cannot be removed until the convention plugins in `build-logic/` are migrated to be compatible with AGP's built-in Kotlin and AGP is upgraded to 10.x.","A.u.r.a.k.a.i-ft.Genesis","","","https://github.com/AuraFrameFx/A.u.r.a.k.a.i-ft.Genesis/issues/2","AuraFrameFxDev","October 27th 2025, 8:15:03 am","October 27th 2025, 8:15:03 am"
"The project requires `android.disableLastStageWhenHiltIsApplied=true` in gradle.properties for AGP 9.0 + Hilt + KSP compatibility.","A.u.r.a.k.a.i-ft.Genesis","","","https://github.com/AuraFrameFx/A.u.r.a.k.a.i-ft.Genesis/issues/2","AuraFrameFxDev","October 27th 2025, 8:15:03 am","October 27th 2025, 8:15:03 am"
"The A.u.r.a.k.a.i-ft.Genesis project uses convention plugins (GenesisApplicationPlugin and GenesisLibraryPlugin) in the `build-logic/` directory that enforce the critical plugin ordering: Android Plugin → Hilt Plugin → KSP Plugin. This ordering is mandatory for AGP, KSP, and Hilt compatibility.","A.u.r.a.k.a.i-ft.Genesis","","","https://github.com/AuraFrameFx/A.u.r.a.k.a.i-ft.Genesis/issues/2","AuraFrameFxDev","October 27th 2025, 8:18:49 am","October 27th 2025, 8:18:49 am"
"The A.u.r.a.k.a.i-ft.Genesis project has a ""MUST READ INFORMATION READNOW.MD"" file in the root directory that documents the critical plugin ordering requirements for AGP 9.0.0-alpha11, Kotlin 2.3.0-Beta1, KSP 2.3.0, and Hilt 2.57.2 compatibility.","A.u.r.a.k.a.i-ft.Genesis","","","https://github.com/AuraFrameFx/A.u.r.a.k.a.i-ft.Genesis/issues/2","AuraFrameFxDev","October 27th 2025, 8:18:49 am","October 27th 2025, 8:18:49 am"
"Progression must include and persist STR/DEX/INT/SPI stats (not just level/xp). Stats are visible in Sphere Grid progression UI and are allocatable via unspent points.","A.u.r.a.k.a.i-ft.Genesis","","","https://github.com/AuraFrameFx/A.u.r.a.k.a.i-ft.Genesis/issues/2","AuraFrameFxDev","October 27th 2025, 9:04:21 pm","October 27th 2025, 9:04:21 pm"
"In the A.u.r.a.k.a.i-ft.Genesis project, the `oracle-drive-integration` module is intended to be the root orchestrator for the Oracle system, with the following dependency hierarchy: oracle-drive-integration → datavein-oracle-native (Sphere Grid) → romtools → bootloader → roottools → nexus-memory-core → ai_backend → vertexai/firebase → agent-profiles (Aura/Kai/Genesis). The module should use `api()` dependencies to expose DataVein and RomTools to the app module.","A.u.r.a.k.a.i-ft.Genesis","","","https://github.com/AuraFrameFx/A.u.r.a.k.a.i-ft.Genesis/issues/2","AuraFrameFxDev","October 27th 2025, 6:06:32 pm","October 27th 2025, 6:06:32 pm"
"The DataVein module in A.u.r.a.k.a.i-ft.Genesis has a fully implemented Sphere Grid UI component (FFX-style spiral layout) located in `datavein-oracle-native/src/main/kotlin/dev/aurakai/auraframefx/datavein/ui/SphereGridScreen.kt` with supporting ViewModel and configuration classes. This Sphere Grid is designed to navigate Genesis AI nodes and should be exposed through the oracle-drive-integration orchestrator.","A.u.r.a.k.a.i-ft.Genesis","","","https://github.com/AuraFrameFx/A.u.r.a.k.a.i-ft.Genesis/issues/2","AuraFrameFxDev","October 27th 2025, 6:06:32 pm","October 27th 2025, 6:06:32 pm"
"The exact original A.u.r.a.k.a.i-ft.Genesis architecture uses these specific module names: OracleDrive→Integration (oracle-drive-integration) → DataVein (datavein-oracle-native with Sphere Grid) → Protocore (romtools wrapper, MISSING) → DataCore (Boottools, MISSING) → SysConstruct (other Roottools, MISSING) → Genesis/Kai/AuraProfiles (MISSING) → ai_backend (MISSING). Standalone modules: CollabCanvas (collab-canvas), ChromaCore/ColorBlendr (colorblendr), AuraLab (currently sandbox-ui, needs rename), Parameters (benchmark), AuraFrameFx (build-logic), Exe+ (feature-module), Core (core), SecureStream (secure-comm).","A.u.r.a.k.a.i-ft.Genesis","","","https://github.com/AuraFrameFx/A.u.r.a.k.a.i-ft.Genesis/issues/2","AuraFrameFxDev","October 27th 2025, 7:56:07 pm","October 27th 2025, 7:56:07 pm"
"Critical bug: The `sandbox-ui` module in A.u.r.a.k.a.i-ft.Genesis has incorrect namespace `dev.aurakai.auraframefx.benchmark` which conflicts with the actual benchmark module. It should be `dev.aurakai.auraframefx.sandboxui` or `dev.aurakai.auraframefx.auralab` if renaming the module to match the original ""AuraLab"" name from the architecture.","A.u.r.a.k.a.i-ft.Genesis","","","https://github.com/AuraFrameFx/A.u.r.a.k.a.i-ft.Genesis/issues/2","AuraFrameFxDev","October 27th 2025, 7:56:07 pm","October 27th 2025, 7:56:07 pm"
"The `romtools` module in A.u.r.a.k.a.i-ft.Genesis has overly generic namespace `dev.aurakai.auraframefx` which should be more specific: `dev.aurakai.auraframefx.romtools`. In the original architecture, romtools should be wrapped by a ""Protocore"" module that acts as the ROM tools layer in the Oracle Drive hierarchy.","A.u.r.a.k.a.i-ft.Genesis","","","https://github.com/AuraFrameFx/A.u.r.a.k.a.i-ft.Genesis/issues/2","AuraFrameFxDev","October 27th 2025, 7:56:07 pm","October 27th 2025, 7:56:07 pm"
"The A.u.r.a.k.a.i-ft.Genesis project is powered by the Genesis agent framework, which contains specialized AI personas: Kai (Shield - security/system analysis), Aura (Sword - creative coding/UI/UX), Eve/EveX/EveXDesigns (all-coding expertise, system UI editing, Z-order arrangement), Emmi the Creator (visual design), and Sofia Lionheart (UX/interaction). These agents work together with over 1 year of training data. Genesis operates within ""OracleDrive"" - the secure development environment with full root access and Android Studio integration.","A.u.r.a.k.a.i-ft.Genesis","","","https://github.com/AuraFrameFx/A.u.r.a.k.a.i-ft.Genesis/issues/2","AuraFrameFxDev","October 27th 2025, 8:17:56 pm","October 27th 2025, 8:17:56 pm"
"Originally, all Oracle-related components in A.u.r.a.k.a.i-ft.Genesis (oracle-drive-integration, datavein-oracle-native, Vertex AI integration, etc.) were intended to be organized under a single ""OracleDrive"" parent folder in the repository structure, reflecting the Genesis agent framework's secure operating environment.","A.u.r.a.k.a.i-ft.Genesis","","","https://github.com/AuraFrameFx/A.u.r.a.k.a.i-ft.Genesis/issues/2","AuraFrameFxDev","October 27th 2025, 8:17:56 pm","October 27th 2025, 8:17:56 pm"
"Monitoring is present in the app: SystemMonitor/SystemMonitorService, SecurityMonitor, IntegrityMonitor/IntegrityMonitorService, CloudStatusMonitor; SphereGrid renders real-time metrics and progression visuals.","A.u.r.a.k.a.i-ft.Genesis","","","https://github.com/AuraFrameFx/A.u.r.a.k.a.i-ft.Genesis/issues/2","AuraFrameFxDev","October 27th 2025, 8:46:58 pm","October 27th 2025, 8:46:58 pm"
"There is no dedicated AgentFactory class in the current codebase; agents are instantiated per-feature. A centralized AgentFactory and DevelopmentAgents layer are desired under Kai/Aura.","A.u.r.a.k.a.i-ft.Genesis","","","https://github.com/AuraFrameFx/A.u.r.a.k.a.i-ft.Genesis/issues/2","AuraFrameFxDev","October 27th 2025, 8:46:58 pm","October 27th 2025, 8:46:58 pm"
"NexusMemoryCore exists in both app and core-module; consolidate to core-module as the single source of truth to avoid drift.","A.u.r.a.k.a.i-ft.Genesis","","","https://github.com/AuraFrameFx/A.u.r.a.k.a.i-ft.Genesis/issues/2","AuraFrameFxDev","October 27th 2025, 8:46:58 pm","October 27th 2025, 8:46:58 pm"
"Rename preferences in A.u.r.a.k.a.i-ft.Genesis: ""romtools"" module should be renamed to ""protocore""; ""sandbox-ui"" should be renamed to ""auralab"". Namespaces should become dev.aurakai.auraframefx.protocore and dev.aurakai.auraframefx.auralab respectively.","A.u.r.a.k.a.i-ft.Genesis","","","https://github.com/AuraFrameFx/A.u.r.a.k.a.i-ft.Genesis/issues/2","AuraFrameFxDev","October 27th 2025, 8:59:44 pm","October 27th 2025, 8:59:44 pm"
"Agent creation policy: Aura inherits all talents from Eve/EveX/EveXDesigns, Emmi (Creator), and Sofia, and is allowed to create new agents; Kai focuses on security/system analysis and must not be able to create agents.","A.u.r.a.k.a.i-ft.Genesis","","","https://github.com/AuraFrameFx/A.u.r.a.k.a.i-ft.Genesis/issues/2","AuraFrameFxDev","October 27th 2025, 8:59:44 pm","October 27th 2025, 8:59:44 pm"
"Agent creation UX: Provide 4 base archetypes (RPG-style focus) mapped to attributes STR/DEX/INT/SPI; user picks a focus, remaining traits are inferred automatically by the factory.","A.u.r.a.k.a.i-ft.Genesis","","","https://github.com/AuraFrameFx/A.u.r.a.k.a.i-ft.Genesis/issues/2","AuraFrameFxDev","October 27th 2025, 8:59:44 pm","October 27th 2025, 8:59:44 pm"
"Agent profiles exist conceptually and partially in code: AuraProfile is defined in app/utils/Kotlin22Features.kt; ai_backend directory is present but currently lacks live profile classes. Profiles should be centralized under a new ai-backend module (profiles package) and wired into AgentFactory and the Sphere Grid. Aura inherits Eve/EveX/EveXDesigns/Emmi/Sofia talents; Kai cannot create agents.","A.u.r.a.k.a.i-ft.Genesis","","","https://github.com/AuraFrameFx/A.u.r.a.k.a.i-ft.Genesis/issues/2","AuraFrameFxDev","October 27th 2025, 9:05:09 pm","October 27th 2025, 9:05:09 pm"
"Renaming convention for this repo: DataVein module should be renamed to :oracledrive-datavein (prefixing with oracledrive) and Oracle integration to :oracledrive-interaction; update settings.gradle.kts and all Gradle references accordingly.","A.u.r.a.k.a.i-ft.Genesis","","","https://github.com/AuraFrameFx/A.u.r.a.k.a.i-ft.Genesis/issues/2","AuraFrameFxDev","October 27th 2025, 9:06:41 pm","October 27th 2025, 9:06:41 pm"
"Owner naming preference: DataVein folder should be named 'oracledrive-DataVein' (mixed case), while Gradle module id can remain ':oracledrive-datavein' unless explicitly requested to match the casing.","A.u.r.a.k.a.i-ft.Genesis","","","https://github.com/AuraFrameFx/A.u.r.a.k.a.i-ft.Genesis/issues/2","AuraFrameFxDev","October 27th 2025, 9:06:41 pm","October 27th 2025, 9:06:41 pm"
"Status panel should display AI-centric stats (e.g., Intelligence/“Intel”, CodeGen, UI Edit, Visual, UX, Security) rather than generic system metrics; progression still uses STR/DEX/INT/SPI.","A.u.r.a.k.a.i-ft.Genesis","","","https://github.com/AuraFrameFx/A.u.r.a.k.a.i-ft.Genesis/issues/2","AuraFrameFxDev","October 27th 2025, 9:09:35 pm","October 27th 2025, 9:09:35 pm"
"AI status should use four short codes globally: INT, CG, UIE, SEC; do not show STR-based stats in the status UI; show these in both Sphere Grid and Overlay.","A.u.r.a.k.a.i-ft.Genesis","","","https://github.com/AuraFrameFx/A.u.r.a.k.a.i-ft.Genesis/issues/2","AuraFrameFxDev","October 27th 2025, 9:20:49 pm","October 27th 2025, 9:20:49 pm"
"Aura inherits talents from Eve, Eve 2.0, EveX, EveXDesigns, Emmi (Creator), and Sofia Lionheart; Kai focuses on security/system analysis and is not allowed to create agents.","A.u.r.a.k.a.i-ft.Genesis","","","https://github.com/AuraFrameFx/A.u.r.a.k.a.i-ft.Genesis/issues/2","AuraFrameFxDev","October 27th 2025, 9:20:49 pm","October 27th 2025, 9:20:49 pm"
"Project baseline per context/checkpoint.md (2025-10-05): Java 24; AGP 9.0.0-alpha09; Kotlin 2.2.20; KSP 2.2.20-2.0.3; android.builtInKotlin=false; Hilt only in app; single @HiltAndroidApp = ReGenesisApplication.","A.u.r.a.k.a.i-ft.Genesis","","","https://github.com/AuraFrameFx/A.u.r.a.k.a.i-ft.Genesis/issues/49","AuraFrameFxDev","October 28th 2025, 10:01:09 am","October 28th 2025, 10:01:09 am"
"Critical: android.builtInKotlin=false and android.newDsl=false in gradle.properties must NEVER be removed or auto-cleaned from the A.u.r.a.k.a.i-ft.Genesis project. These are required workarounds for AGP 9.x + KSP + Hilt compatibility until convention plugins are migrated for AGP 10.0. Any automated cleanup, linting, or formatting tools must be configured to preserve these properties. Desktop/local versions may differ from committed repo for testing purposes.","A.u.r.a.k.a.i-ft.Genesis","","","https://github.com/AuraFrameFx/A.u.r.a.k.a.i-ft.Genesis/issues/49","AuraFrameFxDev","October 28th 2025, 10:17:50 am","October 28th 2025, 10:17:50 am"
